{
  "schema_version": "1.0",
  "dataset_version": "v1",
  "topic": {
    "id": "linux",
    "name": "Linux"
  },
  "questions": [
    {
      "id": "linux-permissions",
      "difficulty": "easy",
      "prompt": "Linux permissions show three little `rwx` groups. Who does each group apply to, and what does execute mean on a directory?",
      "answers": [
        {
          "id": "a",
          "text": "Those mode bits apply to filesystem objects broadly, not only to regular executable files.",
          "verdict": "legit",
          "feedback": {
            "legit": "Mode bits apply broadly to filesystem objects. The source agrees with your Legit vote.",
            "sus": "Mode bits apply broadly to filesystem objects. This one was safe to mark Legit."
          }
        },
        {
          "id": "b",
          "text": "For a directory, execute controls traversal and access through it. You are not 'running' the directory.",
          "verdict": "legit",
          "feedback": {
            "legit": "Execute permission on a directory controls traversal rather than running the directory. The evidence backs your Legit choice.",
            "sus": "Execute permission on a directory controls traversal rather than running the directory. This was accurate as written."
          }
        },
        {
          "id": "c",
          "text": "The three groups belong to the owning user, the owning group, and everyone else.",
          "verdict": "legit",
          "feedback": {
            "legit": "They are grouped for the owning user, owning group, and others. Your call matches the underlying rule.",
            "sus": "They are grouped for the owning user, owning group, and others. This reply deserved a Legit vote."
          }
        }
      ],
      "reference": {
        "title": "Linux man-pages project",
        "url": "https://man7.org/linux/man-pages/"
      },
      "review_status": "approved"
    },
    {
      "id": "linux-process",
      "difficulty": "easy",
      "prompt": "A program file can launch more than once, so what makes each running Linux process its own thing?",
      "answers": [
        {
          "id": "a",
          "text": "Each process gets an identifier and its own virtual address-space context among its runtime resources.",
          "verdict": "legit",
          "feedback": {
            "legit": "Each process has an identifier and a virtual address space. This supports the Legit label you chose.",
            "sus": "Each process has an identifier and a virtual address space. The claim is supported rather than suspicious."
          }
        },
        {
          "id": "b",
          "text": "Think of it as a running instance of a program, complete with execution state and resources managed by the kernel.",
          "verdict": "legit",
          "feedback": {
            "legit": "A running program instance with execution state and resources. Legit was the accurate read.",
            "sus": "A running program instance with execution state and resources. The Sus label does not fit this claim."
          }
        },
        {
          "id": "c",
          "text": "A process is just the executable file on disk, and Linux permits only one running instance of that file.",
          "verdict": "sus",
          "feedback": {
            "legit": "The same executable can be used by many processes. The source contradicts the original reply.",
            "sus": "The same executable can be used by many processes. You spotted the misleading part."
          }
        }
      ],
      "reference": {
        "title": "Linux man-pages project",
        "url": "https://man7.org/linux/man-pages/"
      },
      "review_status": "approved"
    },
    {
      "id": "linux-pipe",
      "difficulty": "easy",
      "prompt": "In `a | b`, what stream leaves command `a`, and where exactly does the shell connect it on `b`?",
      "answers": [
        {
          "id": "a",
          "text": "The shell connects `a`'s standard output to `b`'s standard input.",
          "verdict": "legit",
          "feedback": {
            "legit": "The standard output of `a` to the standard input of `b`. The source agrees with your Legit vote.",
            "sus": "The standard output of `a` to the standard input of `b`. This is a Legit statement, not a trap."
          }
        },
        {
          "id": "b",
          "text": "It automatically joins the filesystems of the machines running the two commands, even across a network.",
          "verdict": "sus",
          "feedback": {
            "legit": "A shell pipe carries a byte stream between local processes unless other tools add networking. The source contradicts the original reply.",
            "sus": "A shell pipe carries a byte stream between local processes unless other tools add networking. You flagged exactly what was wrong."
          }
        },
        {
          "id": "c",
          "text": "The pipe preserves whatever record boundaries the first application used, so the second receives intact messages.",
          "verdict": "sus",
          "feedback": {
            "legit": "A normal pipe is a byte stream; applications must define their own framing when needed. The original reply should be marked Sus.",
            "sus": "A normal pipe is a byte stream; applications must define their own framing when needed. Sus was the correct call here."
          }
        }
      ],
      "reference": {
        "title": "Linux man-pages project",
        "url": "https://man7.org/linux/man-pages/"
      },
      "review_status": "approved"
    },
    {
      "id": "linux-fork",
      "difficulty": "medium",
      "prompt": "After a process calls `fork()`, what exists on the other side of that call, and is all memory copied immediately?",
      "answers": [
        {
          "id": "a",
          "text": "The child is a separate process with its own PID, even though it begins from the parent's state.",
          "verdict": "legit",
          "feedback": {
            "legit": "The child is a separate process with its own PID. You were right to trust this reply.",
            "sus": "The child is a separate process with its own PID. This one was safe to mark Legit."
          }
        },
        {
          "id": "b",
          "text": "Copy-on-write commonly lets them share physical pages until one process modifies a page.",
          "verdict": "legit",
          "feedback": {
            "legit": "Copy-on-write commonly delays copying memory pages until one process writes. Your Legit vote was right.",
            "sus": "Copy-on-write commonly delays copying memory pages until one process writes. This was accurate as written."
          }
        },
        {
          "id": "c",
          "text": "You get a child process initially based on the caller. Both processes continue from the return point of `fork()`.",
          "verdict": "legit",
          "feedback": {
            "legit": "A child process initially based on the calling process. Your Legit judgment holds up.",
            "sus": "A child process initially based on the calling process. This reply deserved a Legit vote."
          }
        }
      ],
      "reference": {
        "title": "Linux man-pages project",
        "url": "https://man7.org/linux/man-pages/"
      },
      "review_status": "approved"
    },
    {
      "id": "linux-signal",
      "difficulty": "medium",
      "prompt": "Unix signals are called asynchronous notifications. How reliable are they as a message queue, and can every signal be caught?",
      "answers": [
        {
          "id": "a",
          "text": "Some signals can be handled or blocked, but `SIGKILL` cannot be caught or ignored.",
          "verdict": "legit",
          "feedback": {
            "legit": "Some signals can be handled or blocked, while SIGKILL cannot be caught. That makes your Legit call correct.",
            "sus": "Some signals can be handled or blocked, while SIGKILL cannot be caught. This one was safe to mark Legit."
          }
        },
        {
          "id": "b",
          "text": "A signal is an asynchronous notification delivered to a process or, in some cases, a particular thread.",
          "verdict": "legit",
          "feedback": {
            "legit": "An asynchronous notification delivered to a process or thread. This supports the Legit label you chose.",
            "sus": "An asynchronous notification delivered to a process or thread. This was accurate as written."
          }
        },
        {
          "id": "c",
          "text": "Signals form an unlimited reliable queue. Repeated identical notifications are always preserved one by one.",
          "verdict": "sus",
          "feedback": {
            "legit": "Standard signals can coalesce and are not an unlimited message queue. The original reply should be marked Sus.",
            "sus": "Standard signals can coalesce and are not an unlimited message queue. That makes your Sus choice accurate."
          }
        }
      ],
      "reference": {
        "title": "Linux man-pages project",
        "url": "https://man7.org/linux/man-pages/"
      },
      "review_status": "approved"
    },
    {
      "id": "linux-symlink",
      "difficulty": "medium",
      "prompt": "What does a symbolic link store, and why can it cross filesystems or point at something that does not exist yet?",
      "answers": [
        {
          "id": "a",
          "text": "It stores a path that will be resolved when the link is followed.",
          "verdict": "legit",
          "feedback": {
            "legit": "A symbolic link stores a path to another filesystem object. That is a solid Legit pick.",
            "sus": "A symbolic link stores a path to another filesystem object. This was accurate as written."
          }
        },
        {
          "id": "b",